{
  "$schema": "https://json-schema.org/draft/2020-12/schema",
  "$id": "urn:research-loom:core:capability-descriptor:0.1.0",
  "title": "research-loom canonical Research Capability descriptor",
  "description": "Implementation-neutral identity and declared-function contract for a Research Capability. Descriptor availability is descriptive only and is never runtime authorization.",
  "type": "object",
  "additionalProperties": false,
  "required": [
    "schema_version",
    "capability_id",
    "capability_version",
    "capability_kind",
    "implementation_boundary",
    "declared_functions",
    "availability",
    "compatibility",
    "descriptor_digest"
  ],
  "properties": {
    "schema_version": {
      "const": "0.1.0"
    },
    "capability_id": {
      "$ref": "#/$defs/capability_id"
    },
    "capability_version": {
      "$ref": "#/$defs/semver"
    },
    "capability_kind": {
      "type": "string",
      "pattern": "^[a-z][a-z0-9._-]{0,127}$"
    },
    "implementation_boundary": {
      "const": "plugin"
    },
    "declared_functions": {
      "type": "array",
      "minItems": 1,
      "items": {
        "$ref": "#/$defs/function"
      }
    },
    "availability": {
      "$ref": "#/$defs/availability"
    },
    "compatibility": {
      "$ref": "#/$defs/compatibility"
    },
    "descriptor_digest": {
      "$ref": "#/$defs/digest"
    }
  },
  "$defs": {
    "identifier": {
      "type": "string",
      "pattern": "^[A-Za-z0-9][A-Za-z0-9._-]{0,127}$"
    },
    "capability_id": {
      "type": "string",
      "pattern": "^[a-z0-9][a-z0-9._-]{0,127}$"
    },
    "function_id": {
      "type": "string",
      "pattern": "^[a-z0-9][a-z0-9._-]{0,127}$"
    },
    "semver": {
      "type": "string",
      "pattern": "^(0|[1-9][0-9]*)\\.(0|[1-9][0-9]*)\\.(0|[1-9][0-9]*)$"
    },
    "digest": {
      "type": "string",
      "pattern": "^sha256:[0-9a-f]{64}$"
    },
    "execution_mode": {
      "enum": [
        "real",
        "virtual",
        "synthetic_test"
      ]
    },
    "function": {
      "type": "object",
      "additionalProperties": false,
      "required": [
        "function_id",
        "description",
        "supported_execution_modes",
        "input_contract",
        "output_contract"
      ],
      "properties": {
        "function_id": {
          "$ref": "#/$defs/function_id"
        },
        "description": {
          "type": "string",
          "minLength": 1
        },
        "supported_execution_modes": {
          "type": "array",
          "minItems": 1,
          "uniqueItems": true,
          "items": {
            "$ref": "#/$defs/execution_mode"
          }
        },
        "input_contract": {
          "const": "capability-context-pack@0.1.0"
        },
        "output_contract": {
          "const": "capability-handoff@0.1.0"
        }
      }
    },
    "availability": {
      "type": "object",
      "additionalProperties": false,
      "required": [
        "declaration"
      ],
      "properties": {
        "declaration": {
          "enum": [
            "available",
            "unavailable",
            "conditional",
            "unknown"
          ]
        },
        "rationale": {
          "type": "string",
          "minLength": 1
        }
      }
    },
    "compatibility": {
      "type": "object",
      "additionalProperties": false,
      "required": [
        "core_research_contract",
        "project_config_contract",
        "effective_profile_set_contract"
      ],
      "properties": {
        "core_research_contract": {
          "$ref": "#/$defs/semver"
        },
        "project_config_contract": {
          "$ref": "#/$defs/semver"
        },
        "effective_profile_set_contract": {
          "$ref": "#/$defs/semver"
        }
      }
    }
  }
}
