{"schema_version":"0.1.0","capability_id":"fixture.virtual-runner","capability_version":"0.1.0","capability_kind":"execution_backend.virtual_runner","implementation_boundary":"plugin","declared_functions":[{"function_id":"execute","description":"Execute an approved Research Method RunSpec with synthetic participants or responses to detect pre-REAL defects without producing empirical research content.","supported_execution_modes":["virtual"],"input_contract":"capability-context-pack@0.1.0","output_contract":"capability-handoff@0.1.0"}],"availability":{"declaration":"conditional","rationale":"Contract only; runtime and authorization are separate."},"compatibility":{"core_research_contract":"0.1.0","project_config_contract":"0.1.0","effective_profile_set_contract":"0.1.0"},"descriptor_digest":"sha256:a84af5e7b5a3abbb5a10c9ed0c1ce71ccadeb65a966619437c6d5a22e59a7aab"}
