{
  "schema_version":"0.1.0",
  "capability_id":"fixture.delphi",
  "capability_version":"0.1.0",
  "capability_kind":"research_method.delphi",
  "implementation_boundary":"plugin",
  "declared_functions":[
    {"function_id":"method_design","description":"Propose Delphi method-design candidate material without adopting a Core Method.","supported_execution_modes":["real","virtual","synthetic_test"],"input_contract":"capability-context-pack@0.1.0","output_contract":"capability-handoff@0.1.0"},
    {"function_id":"instrument_design","description":"Propose a versioned Delphi round instrument with stable item lineage without approving it.","supported_execution_modes":["real","virtual","synthetic_test"],"input_contract":"capability-context-pack@0.1.0","output_contract":"capability-handoff@0.1.0"},
    {"function_id":"execute","description":"Execute pinned Delphi rounds while preserving participation, controlled-feedback provenance, missingness, and dissent.","supported_execution_modes":["real","virtual","synthetic_test"],"input_contract":"capability-context-pack@0.1.0","output_contract":"capability-handoff@0.1.0"},
    {"function_id":"analyze","description":"Produce candidate Delphi consensus, stability, disagreement, and stopping assessments without adopting Findings.","supported_execution_modes":["real","virtual","synthetic_test"],"input_contract":"capability-context-pack@0.1.0","output_contract":"capability-handoff@0.1.0"}
  ],
  "availability":{"declaration":"conditional","rationale":"Contract only; runtime and authorization are separate."},
  "compatibility":{"core_research_contract":"0.1.0","project_config_contract":"0.1.0","effective_profile_set_contract":"0.1.0"},
  "descriptor_digest":"sha256:77b7243b35147fbc56d36006a8e7355808fbf4d898e04789acd476de04042756"
}