{"schema_version":"0.1.0","capability_id":"virtual-runner","capability_version":"0.1.0","capability_kind":"execution_backend.virtual_runner","implementation_boundary":"plugin","declared_functions":[{"function_id":"execute","description":"Execute an approved Survey RunSpec against the exact canonical Instrument with a configured synthetic response backend (structural or LLM) to support pre-REAL inspection without producing empirical research content.","supported_execution_modes":["virtual"],"input_contract":"capability-context-pack@0.1.0","output_contract":"capability-handoff@0.1.0"}],"availability":{"declaration":"conditional","rationale":"Survey-only production binding; exact approved method/protocol/instrument pins and runtime authorization remain required."},"compatibility":{"core_research_contract":"0.1.0","project_config_contract":"0.1.0","effective_profile_set_contract":"0.1.0"},"descriptor_digest":"sha256:ce6e66e3197bee4d6c274d0632f7db7428e435398fbcf7577aa9de303c72ca15"}
